adult,belongs_to_collection,budget,genres,homepage,id,imdb_id,original_language,original_title,overview,popularity,poster_path,production_companies,production_countries,release_date,revenue,runtime,spoken_languages,status,tagline,title,video,vote_average,vote_count
False,,116000000,"[{'id': 878, 'name': 'Science Fiction'}]",http://www.venom.movie/site/,335983,tt1270797,en,Venom,"When Eddie Brock acquires the powers of a symbiote, he will have to release his alter-ego ""Venom"" to save his life.",404.784,/2uNW4WbgBXL25BAbXGLnLqX71Sw.jpg,"[{'id': 5, 'logo_path': '/71BqEFAF4V3qjjMPCpLuyJFB9A.png', 'name': 'Columbia Pictures', 'origin_country': 'US'}, {'id': 7505, 'logo_path': '/837VMM4wOkODc1idNxGT0KQJlej.png', 'name': 'Marvel Entertainment', 'origin_country': 'US'}, {'id': 34, 'logo_path': '/GagSvqWlyPdkFHMfQ3pNq6ix9P.png', 'name': 'Sony Pictures', 'origin_country': 'US'}, {'id': 31828, 'logo_path': None, 'name': 'Avi Arad Productions', 'origin_country': 'US'}]","[{'iso_3166_1': 'US', 'name': 'United States of America'}]",2018-10-03,508400000,112,"[{'iso_639_1': 'en', 'name': 'English'}]",Released,The world has enough Superheroes.,Venom,False,6.6,1701
False,"{'id': 91361, 'name': 'Halloween Collection', 'poster_path': '/2uqHV6YcD9jEL2WuJYjXiiuRDqd.jpg', 'backdrop_path': '/mmxf1sOe2T1sma0tH0TgTdcit1p.jpg'}",10000000,"[{'id': 27, 'name': 'Horror'}, {'id': 53, 'name': 'Thriller'}]",https://www.halloweenmovie.com,424139,tt1502407,en,Halloween,"Laurie Strode comes to her final confrontation with Michael Myers, the masked figure who has haunted her since she narrowly escaped his killing spree on Halloween night four decades ago.",297.383,/bXs0zkv2iGVViZEy78teg2ycDBm.jpg,"[{'id': 33, 'logo_path': '/8lvHyhjr8oUKOOy2dKXoALWKdp0.png', 'name': 'Universal Pictures', 'origin_country': 'US'}, {'id': 3172, 'logo_path': '/kDedjRZwO8uyFhuHamomOhN6fzG.png', 'name': 'Blumhouse Productions', 'origin_country': 'US'}, {'id': 15822, 'logo_path': '/Aodu1OPI0LHTWYr7Jlm4R2XY2og.png', 'name': 'Trancas International Films', 'origin_country': 'US'}, {'id': 20848, 'logo_path': None, 'name': 'Rough House Pictures', 'origin_country': 'US'}]","[{'iso_3166_1': 'US', 'name': 'United States of America'}]",2018-10-18,0,106,"[{'iso_639_1': 'en', 'name': 'English'}]",Released,Face your fate,Halloween,False,6.7,370
False,,36000000,"[{'id': 18, 'name': 'Drama'}, {'id': 10402, 'name': 'Music'}, {'id': 10749, 'name': 'Romance'}]",http://astarisbornmovie.com,332562,tt1517451,en,A Star Is Born,"Seasoned musician Jackson Maine discovers—and falls in love with—struggling artist Ally. She has just about given up on her dream to make it big as a singer—until Jack coaxes her into the spotlight. But even as Ally's career takes off, the personal side of their relationship is breaking down, as Jack fights an ongoing battle with his own internal demons.",208.39,/wrFpXMNBRj2PBiN4Z5kix51XaIZ.jpg,"[{'id': 3528, 'logo_path': '/cCzCClIzIh81Fa79hpW5nXoUsHK.png', 'name': 'Thunder Road Pictures', 'origin_country': 'US'}, {'id': 83035, 'logo_path': None, 'name': '22 & Green', 'origin_country': 'US'}, {'id': 975, 'logo_path': None, 'name': 'Gerber Pictures', 'origin_country': 'US'}, {'id': 83036, 'logo_path': None, 'name': 'Joint Effort', 'origin_country': 'US'}, {'id': 171, 'logo_path': None, 'name': 'Malpaso Productions', 'origin_country': 'US'}]","[{'iso_3166_1': 'US', 'name': 'United States of America'}]",2018-10-03,206190867,135,"[{'iso_639_1': 'en', 'name': 'English'}]",Released,,A Star Is Born,False,7.5,1137
False,,29000000,"[{'id': 35, 'name': 'Comedy'}]",https://www.nightschoolmovie.com,454293,tt6781982,en,Night School,"Teddy Walker is a successful salesman whose life takes an unexpected turn when he accidentally blows up his place of employment. Forced to attend night school to get his GED, Teddy soon finds himself dealing with a group of misfit students, his former high school nemesis and a feisty teacher who doesn't think he's too bright.",158.68,/1NSMAaBPSbWv7sGmF8oLGMNb8Qm.jpg,"[{'id': 40268, 'logo_path': '/shdAxUj8uF6exNLrF0kSqYVxCzG.png', 'name': 'HartBeat Productions', 'origin_country': 'US'}, {'id': 49968, 'logo_path': '/gz2hSoMkvMJdTMgCLFGRJErPwXY.png', 'name': 'Will Packer Productions', 'origin_country': 'US'}]","[{'iso_3166_1': 'US', 'name': 'United States of America'}]",2018-09-27,33157615,111,"[{'iso_639_1': 'en', 'name': 'English'}]",Released,,Night School,False,6.3,108
False,"{'id': 399, 'name': 'Predator Collection', 'poster_path': '/6Z7lASptoiRVxiCFvZaFgH9qp7u.jpg', 'backdrop_path': '/fXVzk9OxQwROCuiWvd0Cv76qmZi.jpg'}",88000000,"[{'id': 27, 'name': 'Horror'}, {'id': 878, 'name': 'Science Fiction'}, {'id': 28, 'name': 'Action'}, {'id': 53, 'name': 'Thriller'}]",https://www.foxmovies.com/movies/the-predator,346910,tt3829266,en,The Predator,"From the outer reaches of space to the small-town streets of suburbia, the hunt comes home. Now, the universe’s most lethal hunters are stronger, smarter and deadlier than ever before, having genetically upgraded themselves with DNA from other species. When a young boy accidentally triggers their return to Earth, only a ragtag crew of ex-soldiers and a disgruntled science teacher can prevent the end of the human race.",122.121,/wMq9kQXTeQCHUZOG4fAe5cAxyUA.jpg,"[{'id': 1302, 'logo_path': '/kQZtJdyphCmq292iGDqlUx0yk2D.png', 'name': 'Davis Entertainment', 'origin_country': 'US'}, {'id': 22213, 'logo_path': '/qx9K6bFWJupwde0xQDwOvXkOaL8.png', 'name': 'TSG Entertainment', 'origin_country': 'US'}, {'id': 25, 'logo_path': '/qZCc1lty5FzX30aOCVRBLzaVmcp.png', 'name': '20th Century Fox', 'origin_country': 'US'}, {'id': 1786, 'logo_path': '/joLFuCWg9e2lweYnFQtRPJKSLlI.png', 'name': 'Dark Castle Entertainment', 'origin_country': 'US'}]","[{'iso_3166_1': 'US', 'name': 'United States of America'}]",2018-09-13,115839700,107,"[{'iso_639_1': 'en', 'name': 'English'}]",Released,The Hunt Has Evolved,The Predator,False,5.3,687
False,"{'id': 86117, 'name': 'Johnny English Collection', 'poster_path': '/3a2BVS2aFHK66pnIqFKcJ9HaC45.jpg', 'backdrop_path': '/pMHHhMKu2iQichL6Eym4ApCvIEB.jpg'}",0,"[{'id': 12, 'name': 'Adventure'}, {'id': 10751, 'name': 'Family'}, {'id': 28, 'name': 'Action'}, {'id': 35, 'name': 'Comedy'}]",,463272,tt6921996,en,Johnny English Strikes Again,"Disaster strikes when a criminal mastermind reveals the identities of all active undercover agents in Britain. The secret service can now rely on only one man—Johnny English. Currently teaching at a minor prep school, Johnny springs back into action to find the mysterious hacker. For this mission to succeed, he’ll need all of his skills—what few he has—as the man with yesterday’s analogue methods faces off against tomorrow’s digital technology.",106.293,/tCBxnZwLiY1BOKw3tH6AxHZdqPh.jpg,"[{'id': 10163, 'logo_path': '/cifwIG2aVR1dRis6yoiilq4qeIh.png', 'name': 'Working Title Films', 'origin_country': 'GB'}, {'id': 694, 'logo_path': '/5LEHONGkZBIoWvp1ygHOF8iyi1M.png', 'name': 'StudioCanal', 'origin_country': 'FR'}, {'id': 33, 'logo_path': '/8lvHyhjr8oUKOOy2dKXoALWKdp0.png', 'name': 'Universal Pictures', 'origin_country': 'US'}]","[{'iso_3166_1': 'US', 'name': 'United States of America'}, {'iso_3166_1': 'FR', 'name': 'France'}, {'iso_3166_1': 'GB', 'name': 'United Kingdom'}]",2018-09-13,66,87,"[{'iso_639_1': 'en', 'name': 'English'}]",Released,Intelligence is a deadly tool,Johnny English Strikes Again,False,6.2,251
False,,70000000,"[{'id': 36, 'name': 'History'}, {'id': 18, 'name': 'Drama'}]",https://www.firstman.com/,369972,tt1213641,en,First Man,"A look at the life of the astronaut, Neil Armstrong, and the legendary space mission that led him to become the first man to walk on the Moon on July 20, 1969.",104.658,/i91mfvFcPPlaegcbOyjGgiWfZzh.jpg,"[{'id': 7, 'logo_path': '/9YHAhaqpFKDq66Alz7HrYd1iM6G.png', 'name': 'DreamWorks', 'origin_country': 'US'}, {'id': 12292, 'logo_path': '/llGRXF5WYUW2fzXg0ebCoKMXjmT.png', 'name': 'Temple Hill Entertainment', 'origin_country': 'US'}, {'id': 33, 'logo_path': '/8lvHyhjr8oUKOOy2dKXoALWKdp0.png', 'name': 'Universal Pictures', 'origin_country': 'US'}, {'id': 56, 'logo_path': '/cEaxANEisCqeEoRvODv2dO1I0iI.png', 'name': 'Amblin Entertainment', 'origin_country': 'US'}, {'id': 109042, 'logo_path': None, 'name': 'Phantasma Films', 'origin_country': 'US'}]","[{'iso_3166_1': 'US', 'name': 'United States of America'}]",2018-10-11,30740236,141,"[{'iso_639_1': 'en', 'name': 'English'}]",Released,One giant leap into the unknown,First Man,False,7.2,359
False,,0,"[{'id': 35, 'name': 'Comedy'}, {'id': 16, 'name': 'Animation'}, {'id': 10751, 'name': 'Family'}, {'id': 12, 'name': 'Adventure'}, {'id': 14, 'name': 'Fantasy'}]",http://www.smallfootmovie.com,446894,tt6182908,en,Smallfoot,A bright young yeti finds something he thought didn't exist—a human. News of this “smallfoot” throws the simple yeti community into an uproar over what else might be out there in the big world beyond their snowy village.,67.66,/4nKoB6wMVXfsYgRZK5lHZ5VMQ6J.jpg,"[{'id': 2785, 'logo_path': '/l5zW8jjmQOCx2dFmvnmbYmqoBmL.png', 'name': 'Warner Bros. Animation', 'origin_country': 'US'}, {'id': 25120, 'logo_path': '/lqUpBvDLQYG3QaKNpe2lxfpgh36.png', 'name': 'Warner Animation Group', 'origin_country': 'US'}, {'id': 174, 'logo_path': '/ky0xOc5OrhzkZ1N6KyUxacfQsCk.png', 'name': 'Warner Bros. Pictures', 'origin_country': 'US'}]","[{'iso_3166_1': 'US', 'name': 'United States of America'}]",2018-09-20,0,96,"[{'iso_639_1': 'en', 'name': 'English'}]",Released,There's been a big myth-understanding,Smallfoot,False,6.5,135
False,"{'id': 508783, 'name': 'Goosebumps Collection', 'poster_path': '/mpyXy3sBPRadEZ2anpRSOy0TkiO.jpg', 'backdrop_path': None}",0,"[{'id': 12, 'name': 'Adventure'}, {'id': 35, 'name': 'Comedy'}, {'id': 14, 'name': 'Fantasy'}, {'id': 27, 'name': 'Horror'}, {'id': 10751, 'name': 'Family'}]",http://www.goosebumps.movie,442062,tt5664636,en,Goosebumps 2: Haunted Halloween,"Two boys face an onslaught from witches, monsters, ghouls and a talking dummy after they discover a mysterious book by author R. L. Stine.",55.72,/8bcpki9GfXdXj9esFpPtlate8v0.jpg,"[{'id': 5, 'logo_path': '/71BqEFAF4V3qjjMPCpLuyJFB9A.png', 'name': 'Columbia Pictures', 'origin_country': 'US'}, {'id': 333, 'logo_path': '/5xUJfzPZ8jWJUDzYtIeuPO4qPIa.png', 'name': 'Original Film', 'origin_country': 'US'}, {'id': 30246, 'logo_path': None, 'name': 'Scholastic Entertainment', 'origin_country': 'US'}, {'id': 105645, 'logo_path': None, 'name': 'Silvertongue Films', 'origin_country': 'US'}, {'id': 2251, 'logo_path': '/8PUjvTVmtJDdDXURTaSoPID0Boj.png', 'name': 'Sony Pictures Animation', 'origin_country': 'US'}]","[{'iso_3166_1': 'US', 'name': 'United States of America'}]",2018-10-11,0,90,"[{'iso_639_1': 'en', 'name': 'English'}]",Released,,Goosebumps 2: Haunted Halloween,False,5.9,63
False,,6000000,"[{'id': 28, 'name': 'Action'}, {'id': 53, 'name': 'Thriller'}, {'id': 27, 'name': 'Horror'}]",,460885,tt6998518,en,Mandy,"The Shadow Mountains, 1983. Red and Mandy lead a loving and peaceful existence; but when their pine-scented haven is savagely destroyed, Red is catapulted into a phantasmagoric journey filled with bloody vengeance and laced with fire.",55.629,/m0yf7J7HsKeK6E81SMRcX8vx6mH.jpg,"[{'id': 34519, 'logo_path': '/MGFizEilC4bv5aDeF8YfEyjDVG.png', 'name': 'SpectreVision', 'origin_country': 'US'}, {'id': 12142, 'logo_path': '/rPnEeMwxjI6rYMGqkWqIWwIJXxi.png', 'name': 'XYZ Films', 'origin_country': 'US'}, {'id': 19037, 'logo_path': '/xhAYgpFmJfcCVLV5NMD8QKvqqHc.png', 'name': 'Umedia', 'origin_country': 'BE'}, {'id': 108869, 'logo_path': '/tfK09IBUnfAwp5htKDPAdzf2z01.png', 'name': 'Legion M', 'origin_country': 'US'}, {'id': 22309, 'logo_path': None, 'name': 'Piccadilly Pictures', 'origin_country': ''}, {'id': 12352, 'logo_path': '/fkIacb6MddD6trIWamr33SIcUAn.png', 'name': 'Wallimage', 'origin_country': 'BE'}]","[{'iso_3166_1': 'US', 'name': 'United States of America'}, {'iso_3166_1': 'BE', 'name': 'Belgium'}]",2018-09-13,1005909,122,"[{'iso_639_1': 'en', 'name': 'English'}]",Released,,Mandy,False,6.4,195
False,,0,"[{'id': 53, 'name': 'Thriller'}, {'id': 80, 'name': 'Crime'}, {'id': 9648, 'name': 'Mystery'}]",https://www.foxmovies.com/movies/bad-times-at-the-el-royale,446021,tt6628394,en,Bad Times at the El Royale,"Seven strangers, each with a secret to bury, meet at Lake Tahoe's El Royale, a rundown hotel with a dark past in 1969. Over the course of one fateful night, everyone will have a last shot at redemption.",53.956,/iNtFgXqXPRMkm1QO8CHn5sHfUgE.jpg,"[{'id': 25, 'logo_path': '/qZCc1lty5FzX30aOCVRBLzaVmcp.png', 'name': '20th Century Fox', 'origin_country': 'US'}]","[{'iso_3166_1': 'US', 'name': 'United States of America'}]",2018-10-04,0,141,"[{'iso_639_1': 'en', 'name': 'English'}]",Released,All Roads Lead Here.,Bad Times at the El Royale,False,6.5,139
False,,42000000,"[{'id': 27, 'name': 'Horror'}, {'id': 14, 'name': 'Fantasy'}, {'id': 53, 'name': 'Thriller'}, {'id': 10751, 'name': 'Family'}, {'id': 9648, 'name': 'Mystery'}]",http://housewithaclock.com,463821,tt2119543,en,The House with a Clock in Its Walls,"Ten-year-old Lewis goes to live with his uncle in a creaky old house that contains a mysterious ticktock noise. When Lewis accidentally awakens the dead, the town's sleepy facade magically springs to life with a secret world of witches and warlocks.",40.125,/qM66Hv4ByAxnilr0jaqCA9uOD4Y.jpg,"[{'id': 56, 'logo_path': '/cEaxANEisCqeEoRvODv2dO1I0iI.png', 'name': 'Amblin Entertainment', 'origin_country': 'US'}, {'id': 34982, 'logo_path': '/uvTmiRZzNfG88dVXi9hQ7eFNirq.png', 'name': 'Mythology Entertainment', 'origin_country': 'US'}]","[{'iso_3166_1': 'US', 'name': 'United States of America'}]",2018-09-15,29950000,105,"[{'iso_639_1': 'en', 'name': 'English'}]",Released,This house knows what makes you tick,The House with a Clock in Its Walls,False,6.3,181
False,,0,"[{'id': 18, 'name': 'Drama'}, {'id': 53, 'name': 'Thriller'}]",http://www.searching.movie,489999,tt7668870,en,Searching,"After his 16-year-old daughter goes missing, a desperate father breaks into her laptop to look for clues to find her. A thriller that unfolds entirely on computer screens.",36.663,/pk9R56ZFlofbBzfwBnHlDyg5DMs.jpg,"[{'id': 11341, 'logo_path': '/xytTBODEy3p20ksHL4Ftxr483Iv.png', 'name': 'Stage 6 Films', 'origin_country': 'US'}, {'id': 1038, 'logo_path': '/o62j8ZNXmRTrq6ThviFWiL9zb8J.png', 'name': 'Bazelevs Production', 'origin_country': 'RU'}, {'id': 109501, 'logo_path': None, 'name': 'Bazelevs Entertainment', 'origin_country': 'US'}]","[{'iso_3166_1': 'RU', 'name': 'Russia'}, {'iso_3166_1': 'US', 'name': 'United States of America'}]",2018-08-24,66265218,101,"[{'iso_639_1': 'en', 'name': 'English'}]",Released,No one is lost without a trace,Searching,False,7.7,345
False,,0,"[{'id': 18, 'name': 'Drama'}, {'id': 80, 'name': 'Crime'}]",http://whiteboyrick.movie,438808,tt4537896,en,White Boy Rick,"The story of teenager, Richard Wershe Jr., who became an undercover informant for the police during the 1980s and was ultimately arrested for drug-trafficking and sentenced to life in prison.",33.973,/376lzYd3vE04qBA5Js93UAKrnvj.jpg,"[{'id': 77863, 'logo_path': '/7z6YOzvdk70YY8OaRbn5mfxrvbO.png', 'name': 'Studio 8', 'origin_country': 'US'}, {'id': 7503, 'logo_path': '/3K8wbNkTn7O4wX89ucnp1ZYR1XF.png', 'name': 'Protozoa Pictures', 'origin_country': 'US'}]","[{'iso_3166_1': 'US', 'name': 'United States of America'}]",2018-09-14,0,116,"[{'iso_639_1': 'en', 'name': 'English'}]",Released,Hustler. Informant. Kingpin. Legend.,White Boy Rick,False,5.7,27
False,,20000000,"[{'id': 53, 'name': 'Thriller'}, {'id': 80, 'name': 'Crime'}, {'id': 9648, 'name': 'Mystery'}]",https://asimplefavor.movie/,484247,tt7040874,en,A Simple Favor,"Mommy vlogger Stephanie joins her best friend Emily’s husband, Sean, to investigate her sudden disappearance from their small town.",33.142,/aIYsjQM0piKc0ibPBCTWv3sqshj.jpg,"[{'id': 61791, 'logo_path': '/xyiy5wZdmnxVViRa8oRMXQQvT6F.png', 'name': 'Feigco Entertainment', 'origin_country': 'US'}, {'id': 13240, 'logo_path': '/aTc07YaNHo8WNgkQSnvLmG6w4nW.png', 'name': 'Bron Studios', 'origin_country': 'CA'}]","[{'iso_3166_1': 'US', 'name': 'United States of America'}]",2018-09-13,85972404,117,"[{'iso_639_1': 'en', 'name': 'English'}]",Released,Can you keep a secret?,A Simple Favor,False,6.5,326
False,,8000000,"[{'id': 80, 'name': 'Crime'}, {'id': 9648, 'name': 'Mystery'}, {'id': 53, 'name': 'Thriller'}, {'id': 18, 'name': 'Drama'}]",https://londonfieldsfilm.com/,220882,tt1273221,en,London Fields,Clairvoyant femme fatale Nicola Six has been living with a dark premonition of her impending death by murder. She begins a tangled love affair with three uniquely different men: one of whom she knows will be her murderer... The film is based on a dystopian Martin Amis novel.,28.354,/Ap6Vqfw2VYHpLnijxCDJq0L8Uuw.jpg,"[{'id': 2458, 'logo_path': None, 'name': 'Tartan Films', 'origin_country': 'GB'}, {'id': 15231, 'logo_path': '/iFbzMtXFBv2ekA9Ldrw6LqjLrvX.png', 'name': 'Muse Productions', 'origin_country': 'US'}, {'id': 4917, 'logo_path': '/qEoPv39l36BaWHLJ4ln751VpcWC.png', 'name': 'Periscope Entertainment', 'origin_country': 'US'}, {'id': 5056, 'logo_path': '/kADFcjL04xe5HGBnlLjbfhliS2a.png', 'name': 'Head Gear Films', 'origin_country': 'GB'}]","[{'iso_3166_1': 'GB', 'name': 'United Kingdom'}]",2018-09-20,116470,118,"[{'iso_639_1': 'en', 'name': 'English'}]",Released,"All of them want her, one of them wants her... dead.",London Fields,False,6.3,14
False,,0,"[{'id': 9648, 'name': 'Mystery'}]",,542202,tt3339680,en,Don't Go,"Devastated by his daughter's death in a terrible accident, Ben becomes convinced that he can bring her back through a recurring dream. But is it just a dream? Or is Ben losing his mind?",27.892,/K6OGjRF5s12HnZBY2ksvB4itWw.jpg,"[{'id': 15465, 'logo_path': '/vk1lVkUzNEkhxP0PEn9ZUEdPTwY.png', 'name': 'Amasia Entertainment', 'origin_country': 'US'}, {'id': 5107, 'logo_path': None, 'name': 'Wide Eye Films', 'origin_country': 'IE'}]","[{'iso_3166_1': 'IE', 'name': 'Ireland'}]",2018-10-26,0,94,[],Released,,Don't Go,False,10.0,1
False,,0,"[{'id': 878, 'name': 'Science Fiction'}, {'id': 18, 'name': 'Drama'}, {'id': 9648, 'name': 'Mystery'}]",,451877,tt6169694,en,I Think We're Alone Now,"After the human race has been wiped out, Del lives in an empty town, content in his solitude and the utopia he has methodically created for himself, until he meets young Grace, who wants to stay with him.",19.498,/9sNsmC8FKgr4hTfnGCS49WY20k4.jpg,"[{'id': 7625, 'logo_path': '/kzq4ibnNeZrp00zpBWv3st1QCOh.png', 'name': 'Automatik Entertainment', 'origin_country': 'US'}, {'id': 107244, 'logo_path': None, 'name': 'Estuary Films', 'origin_country': ''}, {'id': 72844, 'logo_path': None, 'name': 'Slater Hall Productions', 'origin_country': ''}, {'id': 19578, 'logo_path': None, 'name': 'Momentum Pictures', 'origin_country': ''}]","[{'iso_3166_1': 'US', 'name': 'United States of America'}]",2018-09-14,0,100,"[{'iso_639_1': 'en', 'name': 'English'}]",Released,In the end… Chaos will find you,I Think We're Alone Now,False,6.0,35
False,,0,"[{'id': 53, 'name': 'Thriller'}, {'id': 9648, 'name': 'Mystery'}, {'id': 12, 'name': 'Adventure'}, {'id': 18, 'name': 'Drama'}]",,395841,tt5057140,en,Hold the Dark,"In the grim Alaskan winter, a naturalist hunts for wolves blamed for killing a local boy, but he soon finds himself swept into a chilling mystery.",18.188,/1etEySwZQnBJpzgplgadPi5y4PL.jpg,"[{'id': 104213, 'logo_path': '/iavYBtwebxgRYZgo4dmw46RoUIU.png', 'name': 'Addictive Pictures', 'origin_country': 'US'}, {'id': 1976, 'logo_path': '/vuNHAl3LpcNtjtRx8Ml4gpUMO2G.png', 'name': 'filmscience', 'origin_country': 'US'}, {'id': 109865, 'logo_path': '/iCKY5hDzpyV7Iitr3vAIbu7mRFj.png', 'name': 'VisionChaos Productions', 'origin_country': 'CH'}]","[{'iso_3166_1': 'US', 'name': 'United States of America'}]",2018-09-22,0,126,"[{'iso_639_1': 'en', 'name': 'English'}]",Released,,Hold the Dark,False,5.5,194
False,,0,"[{'id': 18, 'name': 'Drama'}, {'id': 53, 'name': 'Thriller'}, {'id': 28, 'name': 'Action'}, {'id': 80, 'name': 'Crime'}]",,283601,tt2315596,en,Galveston,"After a violent encounter, Roy finds Rocky and sees something in her eyes that prompts a fateful decision. He takes her with him as he flees to Galveston, an action as ill-advised as it is inescapable.",17.652,/fZnPtTHw7TfOQoLz3MeAUSLvNK5.jpg,"[{'id': 16280, 'logo_path': '/nuZoi9osmFiDYcbFiK94o6DKZEj.png', 'name': 'Jean Doumanian Productions', 'origin_country': 'US'}, {'id': 28286, 'logo_path': None, 'name': 'Low Spark Films', 'origin_country': 'US'}]","[{'iso_3166_1': 'US', 'name': 'United States of America'}]",2018-10-10,0,94,"[{'iso_639_1': 'en', 'name': 'English'}]",Released,Hell is real,Galveston,False,5.7,23
False,,200000,"[{'id': 27, 'name': 'Horror'}]",https://www.killerkatemovie.com,542781,tt7319064,en,Killer Kate!,"Kate attends her estranged sister's bachelorette party at the request of their dying father. The weekend, held at a remote cabin booked on a home sharing app, turns into a savage life-or-death struggle that pits family against family, and past against present.",17.48,/xEtY9NtzImWHZavWTQMWub6RYgj.jpg,"[{'id': 107820, 'logo_path': '/qJbFNOiKtaK8cVKgF6ILKnkI3BX.png', 'name': 'Feld Films', 'origin_country': 'US'}]",[],2018-10-26,0,80,[],Released,,Killer Kate!,False,5.5,2
False,,0,"[{'id': 28, 'name': 'Action'}]",,399402,tt1846589,en,Hunter Killer,"An untested American submarine captain teams with U.S. Navy Seals to rescue the Russian president, who has been kidnapped by a rogue general.",17.149,/2oNF25PP9ZGLic8n0er0Zf6KNao.jpg,"[{'id': 333, 'logo_path': '/5xUJfzPZ8jWJUDzYtIeuPO4qPIa.png', 'name': 'Original Film', 'origin_country': 'US'}, {'id': 103331, 'logo_path': None, 'name': 'G-BASE', 'origin_country': 'US'}, {'id': 1020, 'logo_path': '/kuUIHNwMec4dwOLghDhhZJzHZTd.png', 'name': 'Millennium Films', 'origin_country': 'US'}]","[{'iso_3166_1': 'US', 'name': 'United States of America'}]",2018-10-19,0,,"[{'iso_639_1': 'en', 'name': 'English'}]",Released,Courage runs deep,Hunter Killer,False,5.9,12
False,,0,"[{'id': 35, 'name': 'Comedy'}, {'id': 18, 'name': 'Drama'}]",http://mid90s.movie,437586,tt5613484,en,Mid90s,"Stevie is a sweet 13-year-old about to explode. His mom is loving and attentive, but a little too forthcoming about her romantic life. His big brother is a taciturn and violent bully. So Stevie searches his working-class Los Angeles suburb for somewhere to belong. He finds it at the Motor Avenue skate shop.",14.742,/lvB5TsUScfgwfjZYusjcuZ9L6oS.jpg,"[{'id': 22842, 'logo_path': '/waIZoO3pnB0VVCUVo8u6hqcYN9U.png', 'name': 'Waypoint Entertainment', 'origin_country': ''}, {'id': 41077, 'logo_path': '/1ZXsGaFPgrgS6ZZGS37AqD5uU12.png', 'name': 'A24', 'origin_country': 'US'}, {'id': 258, 'logo_path': None, 'name': 'Scott Rudin Productions', 'origin_country': 'US'}]","[{'iso_3166_1': 'US', 'name': 'United States of America'}]",2018-10-19,0,84,"[{'iso_639_1': 'en', 'name': 'English'}]",Released,Fall. Get back up.,Mid90s,False,8.3,8
False,,0,"[{'id': 18, 'name': 'Drama'}]",https://www.beautifulboy.movie,451915,tt1226837,en,Beautiful Boy,"After he and his first wife separate, journalist David Sheff struggles to help their teenage son Nic, who goes from experimenting with drugs to becoming devastatingly addicted to methamphetamine.",14.428,/xxWVLnkx9lPMqer70AZRR4OC3KS.jpg,"[{'id': 81, 'logo_path': '/8wOfUhA7vwU2gbPjQy7Vv3EiF0o.png', 'name': 'Plan B Entertainment', 'origin_country': 'US'}, {'id': 6831, 'logo_path': '/ojg8jqsVLGDvuJowOkZQZVV42AA.png', 'name': 'Big Indie Pictures', 'origin_country': 'US'}]","[{'iso_3166_1': 'US', 'name': 'United States of America'}]",2018-10-12,0,111,"[{'iso_639_1': 'en', 'name': 'English'}]",Released,,Beautiful Boy,False,6.4,13
False,,0,"[{'id': 18, 'name': 'Drama'}, {'id': 80, 'name': 'Crime'}]",http://thehateugive.com,470044,tt5580266,en,The Hate U Give,"Raised in a poverty-stricken slum, a 16-year-old girl named Starr now attends a suburban prep school. After she witnesses a police officer shoot her unarmed best friend, she's torn between her two very different worlds as she tries to speak her truth.",14.269,/2gQrVH2rWM3apnUqzigDvafHTJU.jpg,"[{'id': 12292, 'logo_path': '/llGRXF5WYUW2fzXg0ebCoKMXjmT.png', 'name': 'Temple Hill Entertainment', 'origin_country': 'US'}]","[{'iso_3166_1': 'US', 'name': 'United States of America'}]",2018-10-19,0,133,"[{'iso_639_1': 'en', 'name': 'English'}]",Released,Two worlds. One voice. No going back.,The Hate U Give,False,8.0,21
False,,0,"[{'id': 18, 'name': 'Drama'}]",,501630,tt7284204,en,Summer '03,A 16-year-old girl and her extended family are left reeling after her calculating grandmother unveils an array of secrets on her deathbed.,13.769,/12X1KfbX31og1KjttO1jy4c9QC4.jpg,[],[],2018-09-28,0,102,"[{'iso_639_1': 'en', 'name': 'English'}]",Released,Growing up. One mistake at a time.,Summer '03,False,6.0,6
False,,0,"[{'id': 53, 'name': 'Thriller'}]",,486947,tt6742252,da,Den skyldige,"Alarm dispatcher and former police officer, Asger Holm, answers an emergency call from a kidnapped woman. When the call is suddenly disconnected, the search for the woman and her kidnapper begins. With the phone as his only tool, Asger enters a race against time to save the endangered woman. But soon he realizes that he is dealing with a crime that is far bigger than he first thought.",13.608,/6cerQ0XPfNLWrcG6O0nRGQxoAKs.jpg,"[{'id': 235, 'logo_path': '/obOynoztBEhDNfHsDXBqOuQLAZk.png', 'name': 'Nordisk Film', 'origin_country': 'DK'}]","[{'iso_3166_1': 'DK', 'name': 'Denmark'}]",2018-06-14,0,85,"[{'iso_639_1': 'da', 'name': 'Dansk'}, {'iso_639_1': 'en', 'name': 'English'}]",Released,,The Guilty,False,7.6,76
